{
  "libraryId": "secureguide-operational-patterns",
  "version": "1.0.0",
  "authoritative": false,
  "usageLabelAr": "اقتراحات معيارية بناءً على التصنيف",
  "source": {
    "sourceType": "USER_SUPPLIED_OPERATIONAL_GUIDANCE",
    "sourceBatchId": "e5d58e5a-6a5d-43ff-a25b-91e8540ce981",
    "sourceSha256": "2c094f18df28ec75591207f60263d2bcf6aa9e666476633087e44e1b9ce8680f",
    "isOriginalRequirementSource": false,
    "usageConstraint": "Do not present patterns as original source requirements or auto-approve them."
  },
  "patterns": [
    {
      "patternId": "OPP-001",
      "sourceRow": 1,
      "sectionAr": "تقوية الشبكة",
      "sourceTextAr": "تجزئة الشبكات (Network Segmentation): عزل الأنظمة الحرجة والحساسة، مثل قواعد البيانات، عن باقي الشبكة ومنع أي تواصل بين الطرفيات إلا فيما هي مخولة به، والتأكد من عمل العزل لأقسام الشبكة بالشكل المناسب وضبط كل قسم أو جزء بما يلزم من إجراءات.",
      "titleAr": "تجزئة الشبكات (Network Segmentation)",
      "originalClassificationAr": "ضابط أمني وقائي؛ عزل وتقليل سطح الهجوم",
      "originalDeliveryModelAr": "مشروع تقني",
      "recommendedArtifactType": "ART-CTR",
      "primaryDomain": "SD-04",
      "subDomain": "SD-04.01",
      "controlNature": "NAT-TEC",
      "controlFunction": "FUN-PRE",
      "testability": "TST-MAN",
      "requirementType": null,
      "deliveryArchetype": "PROJECT",
      "effortSize": "LARGE",
      "complexity": "HIGH",
      "priority": "PRI-CRITICAL",
      "ownerRoles": [
        "الشبكات",
        "المعمارية الأمنية",
        "مالكو الأنظمة"
      ],
      "implementationActions": [
        "حصر الأصول وتدفقات الاتصال",
        "تصميم مناطق الشبكة",
        "إنشاء VLAN أو Security Zones",
        "تطبيق قواعد Firewall",
        "الاختبار المرحلي",
        "توثيق الاستثناءات"
      ],
      "evidenceExamples": [
        "مخطط الشبكة",
        "مصفوفة الاتصالات",
        "قواعد الجدار الناري",
        "نتائج اختبار العزل"
      ],
      "acceptanceCriteriaAr": "منع جميع الاتصالات غير المصرح بها؛ مراجعة ربع سنوية وبعد كل تغيير جوهري",
      "reviewFrequencies": [
        "QUARTERLY"
      ],
      "requiresSplit": false,
      "safetyReviewRequired": false,
      "safetyNoteAr": null,
      "classificationConfidence": 0.82,
      "classificationRationaleAr": "تصنيف أولي كـضابط أمني ضمن مجال البنية التحتية والشبكات والسحابة استناداً إلى الغرض الغالب في النص؛ يلزم اعتماده بشرياً قبل تحويله إلى عنصر مرجعي أو خطة تشغيلية.",
      "requiresHumanReview": true,
      "aiReviewStatus": "AIR-HUMAN-REVIEW",
      "sourcePatternId": "OPP-001"
    },
    {
      "patternId": "OPP-002",
      "sourceRow": 2,
      "sectionAr": "تقوية الشبكة",
      "sourceTextAr": "عزل السيرفرات عن الإنترنت: تطبيق العزل الشبكي على جميع الخوادم التي لا يتطلب عملها الأساسي اتصالاً مباشراً بشبكة الإنترنت.",
      "titleAr": "عزل السيرفرات عن الإنترنت",
      "originalClassificationAr": "ضابط أمني وقائي؛ تقييد الاتصال الخارجي",
      "originalDeliveryModelAr": "تغيير تشغيلي واسع",
      "recommendedArtifactType": "ART-CTR",
      "primaryDomain": "SD-04",
      "subDomain": "SD-04.01",
      "controlNature": "NAT-TEC",
      "controlFunction": "FUN-PRE",
      "testability": "TST-MAN",
      "requirementType": null,
      "deliveryArchetype": "CONTROLLED_CHANGE",
      "effortSize": "MEDIUM",
      "complexity": "HIGH",
      "priority": "PRI-CRITICAL",
      "ownerRoles": [
        "الشبكات والبنية التحتية ومالكو التطبيقات"
      ],
      "implementationActions": [
        "حصر احتياجات الاتصال",
        "تطبيق Default Deny",
        "السماح بالوجهات المطلوبة فقط",
        "استخدام Proxy أو Repository داخلي",
        "اختبار التطبيقات"
      ],
      "evidenceExamples": [
        "قائمة الخوادم",
        "قواعد الاتصال الصادر",
        "سجلات Firewall",
        "نتائج الاختبار"
      ],
      "acceptanceCriteriaAr": "لا يستطيع أي خادم غير مستثنى الوصول المباشر للإنترنت؛ مراجعة شهرية",
      "reviewFrequencies": [
        "MONTHLY"
      ],
      "requiresSplit": false,
      "safetyReviewRequired": false,
      "safetyNoteAr": null,
      "classificationConfidence": 0.82,
      "classificationRationaleAr": "تصنيف أولي كـضابط أمني ضمن مجال البنية التحتية والشبكات والسحابة استناداً إلى الغرض الغالب في النص؛ يلزم اعتماده بشرياً قبل تحويله إلى عنصر مرجعي أو خطة تشغيلية.",
      "requiresHumanReview": true,
      "aiReviewStatus": "AIR-HUMAN-REVIEW",
      "sourcePatternId": "OPP-002"
    },
    {
      "patternId": "OPP-003",
      "sourceRow": 3,
      "sectionAr": "تقوية الشبكة",
      "sourceTextAr": "تصفية حركة الإنترنت ومنع وصول الموظفين في الشبكة الداخلية إلا لما يسمح به فقط White-List، من خلال جدار الحماية وProxy Server.",
      "titleAr": "تصفية حركة الإنترنت ومنع وصول الموظفين في الشبكة الداخلية إلا لما يسمح به فقط White-List، من خلال جدار الحماية وProxy Server.",
      "originalClassificationAr": "ضابط وقائي؛ تصفية محتوى واتصال",
      "originalDeliveryModelAr": "مشروع تقني متوسط ثم عملية تشغيلية",
      "recommendedArtifactType": "ART-CTR",
      "primaryDomain": "SD-04",
      "subDomain": "SD-04.05",
      "controlNature": "NAT-TEC",
      "controlFunction": "FUN-PRE",
      "testability": "TST-MAN",
      "requirementType": null,
      "deliveryArchetype": "PROJECT",
      "effortSize": "MEDIUM",
      "complexity": "MEDIUM",
      "priority": "PRI-HIGH",
      "ownerRoles": [
        "الشبكات وSOC وأمن المعلومات"
      ],
      "implementationActions": [
        "تصنيف الفئات",
        "تحديد المواقع والتطبيقات المسموحة",
        "إعداد Proxy وFirewall",
        "ضبط الاستثناءات",
        "تسجيل ومراقبة المحاولات"
      ],
      "evidenceExamples": [
        "إعدادات Proxy",
        "قائمة السماح",
        "تقارير الاستخدام والحجب"
      ],
      "acceptanceCriteriaAr": "تمر حركة الويب عبر الحل المعتمد؛ الاستثناءات موثقة ومحددة المدة؛ متابعة شهرية",
      "reviewFrequencies": [
        "MONTHLY"
      ],
      "requiresSplit": false,
      "safetyReviewRequired": false,
      "safetyNoteAr": null,
      "classificationConfidence": 0.82,
      "classificationRationaleAr": "تصنيف أولي كـضابط أمني ضمن مجال البنية التحتية والشبكات والسحابة استناداً إلى الغرض الغالب في النص؛ يلزم اعتماده بشرياً قبل تحويله إلى عنصر مرجعي أو خطة تشغيلية.",
      "requiresHumanReview": true,
      "aiReviewStatus": "AIR-HUMAN-REVIEW",
      "sourcePatternId": "OPP-003"
    },
    {
      "patternId": "OPP-004",
      "sourceRow": 4,
      "sectionAr": "تقوية الشبكة",
      "sourceTextAr": "عزل الموارد الحساسة وحصر الوصول إليها إلا عبر اتصال VPN محمي بواسطة MFA.",
      "titleAr": "عزل الموارد الحساسة وحصر الوصول إليها إلا عبر اتصال VPN محمي بواسطة MFA.",
      "originalClassificationAr": "ضابط وقائي؛ وصول آمن ومصادقة قوية",
      "originalDeliveryModelAr": "مشروع تقني متوسط",
      "recommendedArtifactType": "ART-CTR",
      "primaryDomain": "SD-03",
      "subDomain": "SD-03.05",
      "controlNature": "NAT-TEC",
      "controlFunction": "FUN-PRE",
      "testability": "TST-MAN",
      "requirementType": null,
      "deliveryArchetype": "PROJECT",
      "effortSize": "MEDIUM",
      "complexity": "MEDIUM",
      "priority": "PRI-CRITICAL",
      "ownerRoles": [
        "IAM والشبكات ومالكو الموارد"
      ],
      "implementationActions": [
        "حصر الموارد",
        "ربط VPN بالهوية المركزية وMFA",
        "تطبيق سياسات الوصول",
        "منع المسارات المباشرة",
        "اختبار حالات الفشل"
      ],
      "evidenceExamples": [
        "إعدادات VPN وMFA",
        "سجلات الدخول",
        "نتائج الاختبارات"
      ],
      "acceptanceCriteriaAr": "فشل الوصول خارج VPN أو دون MFA؛ مراجعة الصلاحيات شهرياً",
      "reviewFrequencies": [
        "MONTHLY"
      ],
      "requiresSplit": false,
      "safetyReviewRequired": false,
      "safetyNoteAr": null,
      "classificationConfidence": 0.82,
      "classificationRationaleAr": "تصنيف أولي كـضابط أمني ضمن مجال الهوية والوصول والامتياز استناداً إلى الغرض الغالب في النص؛ يلزم اعتماده بشرياً قبل تحويله إلى عنصر مرجعي أو خطة تشغيلية.",
      "requiresHumanReview": true,
      "aiReviewStatus": "AIR-HUMAN-REVIEW",
      "sourcePatternId": "OPP-004"
    },
    {
      "patternId": "OPP-005",
      "sourceRow": 5,
      "sectionAr": "تقوية الشبكة",
      "sourceTextAr": "إغلاق جميع المنافذ غير المستخدمة في كل السيرفرات وحصر الاتصالات على المنافذ المستخدمة عبر Firewall.",
      "titleAr": "إغلاق جميع المنافذ غير المستخدمة في كل السيرفرات وحصر الاتصالات على المنافذ المستخدمة عبر Firewall.",
      "originalClassificationAr": "إجراء تقوية وقائي",
      "originalDeliveryModelAr": "مهمة تقنية أو تغيير تشغيلي",
      "recommendedArtifactType": "ART-CFG",
      "primaryDomain": "SD-04",
      "subDomain": "SD-04.03",
      "controlNature": null,
      "controlFunction": null,
      "testability": null,
      "requirementType": null,
      "deliveryArchetype": "CONTROLLED_CHANGE",
      "effortSize": "SMALL_MEDIUM",
      "complexity": "MEDIUM",
      "priority": "PRI-CRITICAL",
      "ownerRoles": [
        "مسؤولو الأنظمة والشبكات"
      ],
      "implementationActions": [
        "جرد الخدمات",
        "فحص المنافذ",
        "اعتماد قائمة السماح",
        "إغلاق المنافذ",
        "اختبار وظائف الخادم"
      ],
      "evidenceExamples": [
        "نتائج Port Scan",
        "قواعد Firewall",
        "طلبات التغيير"
      ],
      "acceptanceCriteriaAr": "لا يوجد منفذ مفتوح دون خدمة ومالك ومبرر؛ فحص شهري",
      "reviewFrequencies": [
        "MONTHLY"
      ],
      "requiresSplit": false,
      "safetyReviewRequired": false,
      "safetyNoteAr": null,
      "classificationConfidence": 0.82,
      "classificationRationaleAr": "تصنيف أولي كـإعداد تقني ضمن مجال البنية التحتية والشبكات والسحابة استناداً إلى الغرض الغالب في النص؛ يلزم اعتماده بشرياً قبل تحويله إلى عنصر مرجعي أو خطة تشغيلية.",
      "requiresHumanReview": true,
      "aiReviewStatus": "AIR-HUMAN-REVIEW",
      "sourcePatternId": "OPP-005"
    },
    {
      "patternId": "OPP-006",
      "sourceRow": 6,
      "sectionAr": "تقوية الشبكة",